{
  "lifecycle_change_id": "LCH-0024",
  "schema_version": "v1",
  "candidate_id": "H-008",
  "from_state": "research_concluded",
  "to_state": "archived",
  "transition_edge": "research_concluded->archived",
  "decided_by": "retrospective_backfill_wp_9e",
  "decided_at": "2026-04-16T20:51:27-06:00",
  "evidence_summary": "Retrospective lifecycle backfill for H-008 archival after research conclusion, evidenced by the committed DEC-0008 decision record.",
  "risk_acknowledgment": "Retrospective backfill of historical lifecycle transition; no operational risk implication. Original decision risk was acknowledged in cited evidence artifacts.",
  "evidence_artifact_refs": [
    "research/decisions/DEC-0008.md"
  ],
  "supersedes_lch_id": null,
  "linked_advisory_artifacts": [],
  "retrospective_flag": true,
  "retrospective_disclosure": "Retrospective backfill of research_concluded->archived for H-008. The historical transition is evidenced by research/decisions/DEC-0008.md with decided_at sourced from the first commit timestamp introducing that evidence artifact. This LCH was authored post hoc in WP-9e to populate the Phase 9 lifecycle layer under Decision 7; it does not modify the candidate, the cited evidence artifact, any historical decision, or any runtime behavior.",
  "fast_track_flag": false,
  "strong_candidate_criteria_refs": []
}
