{
  "lifecycle_change_id": "LCH-0011",
  "schema_version": "v1",
  "candidate_id": "H-004",
  "from_state": "in_research",
  "to_state": "research_concluded",
  "transition_edge": "in_research->research_concluded",
  "decided_by": "retrospective_backfill_wp_9e",
  "decided_at": "2026-04-18T23:10:50-06:00",
  "evidence_summary": "Retrospective lifecycle backfill for H-004 research conclusion, evidenced by the committed REP-0005 experiment report.",
  "risk_acknowledgment": "Retrospective backfill of historical lifecycle transition; no operational risk implication. Original decision risk was acknowledged in cited evidence artifacts.",
  "evidence_artifact_refs": [
    "REP-0005"
  ],
  "supersedes_lch_id": null,
  "linked_advisory_artifacts": [],
  "retrospective_flag": true,
  "retrospective_disclosure": "Retrospective backfill of in_research->research_concluded for H-004. The historical transition is evidenced by REP-0005 with decided_at sourced from the first commit timestamp introducing the REP-0005 evidence artifact. This LCH was authored post hoc in WP-9e to populate the Phase 9 lifecycle layer under Decision 7; it does not modify the candidate, the cited evidence artifact, any historical decision, or any runtime behavior.",
  "fast_track_flag": false,
  "strong_candidate_criteria_refs": []
}
